[
  {
    "id": "receipt:1941-operation-order-departure-speed",
    "quote": "… the entire force (except the Midway Bombardment Unit) in accordance with special orders will depart as a group from Hitokappu Bay at a speed of 12-14 knots.",
    "source": "source:japanese-monograph-97",
    "pages": "7",
    "usedIn": ["1941-pearl-harbor:document-operation-order"],
    "how": "fetch",
    "url": "https://www.ibiblio.org/pha/myths/jm-097.html",
    "checkedAt": "2026-08-28",
    "checkedBy": "Claude Opus 5 (agent), for sand-23b.57",
    "context": "Each Force. a. General While exercising strict antiaircraft and antisubmarine measures and making every effort to conceal its position and movements, the entire force (except the Midway Bombardment Unit) in accordance with special orders will depart as a group from Hitokappu Bay at a speed of 12-14 knots. The force refueling en route whenever possible will arrive at the standby point (42 N, 165 W). In the event bad weather prevents refueling en route",
    "repeat": "agreed"
  },
  {
    "id": "receipt:1941-operation-order-hitokappu-secrecy",
    "quote": "… depart with utmost secrecy from Hitokappu Bay on 26 November … advance to the standby point (42 N, 170 W) …",
    "source": "source:japanese-monograph-97",
    "pages": "21",
    "usedIn": ["1941-pearl-harbor:document-operation-order"],
    "how": "fetch",
    "url": "https://www.ibiblio.org/pha/myths/jm-097.html",
    "checkedAt": "2026-08-28",
    "checkedBy": "Claude Opus 5 (agent), for sand-23b.57",
    "context": "eral Outline) 25 November 1941 Order to: Carrier Striking Task Force The Carrier Striking Task Force will immediately complete taking on supplies and depart with utmost secrecy from Hitokappu Bay on 26 November and advance to the standby point (42 N, 170 W) by the evening of 3 December. Commander-in-Chief, Combined Fleet Yamamoto, Isoroku [Page 22] Navy Order No. 9 1 December 1941 Order to: Yamamoto, C i",
    "repeat": "agreed",
    "note": "This passage is Combined Fleet Operations Order No. 5 of 25 November, printed on page 21, after the passages the pack quotes from pages 7, 11 and 13: the excerpt runs in the order of the operation, not in the order of the monograph."
  },
  {
    "id": "receipt:1941-operation-order-turn-south",
    "quote": "Around 0700 hours, X-1 Day the Task Force will turn southward at high speed (approximately 24 knots)",
    "source": "source:japanese-monograph-97",
    "pages": "11",
    "usedIn": ["1941-pearl-harbor:document-operation-order"],
    "how": "fetch",
    "url": "https://www.ibiblio.org/pha/myths/jm-097.html",
    "checkedAt": "2026-08-28",
    "checkedBy": "Claude Opus 5 (agent), for sand-23b.57",
    "context": "nce of the order designating X Day (the day of the outbreak of hostilities), the force will proceed to the approaching point (32 N, 157 W). [Page 11] Around 0700 hours, X-1 Day the Task Force will turn southward at high speed (approximately 24 knots) from the vicinity of the approaching point. It will arrive at the take-off point (200 nautical miles north of the enemy fleet anchorage) at 0100 hours X Day (0530 Honolulu time) a",
    "repeat": "agreed"
  },
  {
    "id": "receipt:1941-operation-order-course-180",
    "quote": "advance on a course of 180 degrees from 0700 hours X-1 Day at an increased speed of 24 knots",
    "source": "source:japanese-monograph-97",
    "pages": "13",
    "usedIn": ["1941-pearl-harbor:document-operation-order"],
    "how": "fetch",
    "url": "https://www.ibiblio.org/pha/myths/jm-097.html",
    "checkedAt": "2026-08-28",
    "checkedBy": "Claude Opus 5 (agent), for sand-23b.57",
    "context": "decided as follows: 1. The Operation of the Air Attack Forces The force will be 700 nautical miles due north of point Z (set at the western extremity of the Island of Lanai) at 0600 hours X-1 Day and advance on a course of 180 degrees from 0700 hours X-1 Day at an increased speed of 24 knots. Air attacks will be carried out by launching the first attack units 230 nautical miles due north of Z point at 0130 hours X Day, and the second atta",
    "repeat": "agreed",
    "note": "The excerpt runs these two sentences together with an ellipsis, but they are on different printed pages of the monograph — 11 and 13 — so they are two receipts and carry their own page each, rather than one receipt claiming a page it only half saw."
  },
  {
    "id": "receipt:1941-operation-order-launch-points",
    "quote": "… 230 nautical miles due north of Z point at 0130 hours X Day … 200 nautical miles due north of Z point at 0245 hours …",
    "source": "source:japanese-monograph-97",
    "pages": "13",
    "usedIn": ["1941-pearl-harbor:document-operation-order"],
    "how": "fetch",
    "url": "https://www.ibiblio.org/pha/myths/jm-097.html",
    "checkedAt": "2026-08-28",
    "checkedBy": "Claude Opus 5 (agent), for sand-23b.57",
    "context": "course of 180 degrees from 0700 hours X-1 Day at an increased speed of 24 knots. Air attacks will be carried out by launching the first attack units 230 nautical miles due north of Z point at 0130 hours X Day, and the second attack unit at 200 nautical miles due north of Z point at 0245 hours. After the launching of the second attack units is completed, the task force will withdraw northward at a speed of about 24 knots. The first attack u",
    "repeat": "agreed"
  },
  {
    "id": "receipt:1941-operation-order-withdrawal",
    "quote": "After the launching of the second attack units is completed, the task force will withdraw northward at a speed of about 24 knots.",
    "source": "source:japanese-monograph-97",
    "pages": "13",
    "usedIn": ["1941-pearl-harbor:document-operation-order"],
    "how": "fetch",
    "url": "https://www.ibiblio.org/pha/myths/jm-097.html",
    "checkedAt": "2026-08-28",
    "checkedBy": "Claude Opus 5 (agent), for sand-23b.57",
    "context": "its 230 nautical miles due north of Z point at 0130 hours X Day, and the second attack unit at 200 nautical miles due north of Z point at 0245 hours. After the launching of the second attack units is completed, the task force will withdraw northward at a speed of about 24 knots. The first attack units are scheduled to return between 0530 and 0600 hours and the second attack units are scheduled to return between 0645 and 0715",
    "repeat": "agreed"
  }
]
